{
  "$schema": "./schemas/catalog.schema.json",
  "catalog_version": "1.0.0",
  "name": "Open Shema Data Hub",
  "description": "Catalogue officiel des ressources bibliques, théologiques, dictionnaires et jeux de données libres de droits pour l'écosystème Open Shema.",
  "repository": "https://github.com/Similarly1/open-shema-data",
  "cdn_base_url": "https://cdn.jsdelivr.net/gh/Similarly1/open-shema-data@main",
  "updated_at": "2026-08-28T17:05:00Z",
  "categories": [
    { "id": "bibles", "label": "Textes & Versions Bibliques", "icon": "book-open" },
    { "id": "dictionaries", "label": "Dictionnaires & Lexiques", "icon": "spell-check" },
    { "id": "commentaries", "label": "Commentaires Bibliques", "icon": "message-square" },
    { "id": "theology", "label": "Ouvrages de Théologie & Confessions", "icon": "library" },
    { "id": "datasets", "label": "Jeux de Données & Multimédias", "icon": "database" }
  ],
  "modules": [
    {
      "id": "bible-lsg-1910",
      "type": "bible",
      "category": "bibles",
      "title": "Louis Segond 1910 (avec Strongs)",
      "abbreviation": "LSG",
      "language": "fr",
      "format": "sqlite",
      "size_bytes": 21045248,
      "version": "1.0.0",
      "license": "Public Domain",
      "author": "Louis Segond",
      "description": "Bible Louis Segond 1910 avec numérotation Strong complète (Hébreu & Grec)",
      "features": ["strong", "indexed_search", "testaments_ot_nt"],
      "download_url": "https://raw.githubusercontent.com/Similarly1/open-shema-data/main/data/bibles/bible_lsg1910.sqlite",
      "cover_url": "https://raw.githubusercontent.com/Similarly1/open-shema-data/main/data/covers/LSG.png"
    },
    {
      "id": "bible-darby",
      "type": "bible",
      "category": "bibles",
      "title": "Bible J.N. Darby (avec Strong)",
      "abbreviation": "DARBY",
      "language": "fr",
      "format": "sqlite",
      "size_bytes": 22319104,
      "version": "1.0.0",
      "license": "Public Domain",
      "author": "John Nelson Darby",
      "description": "Traduction littérale et rigoureuse de John Nelson Darby (66 livres, 31 171 versets) avec balisage Strong complet.",
      "features": ["strong", "indexed_search", "literal_translation"],
      "download_url": "https://raw.githubusercontent.com/Similarly1/open-shema-data/main/data/bibles/bible_darby.sqlite",
      "cover_url": "https://raw.githubusercontent.com/Similarly1/open-shema-data/main/data/covers/DARBY.png"
    },
    {
      "id": "bible-ostervald-1877",
      "type": "bible",
      "category": "bibles",
      "title": "Bible Ostervald",
      "abbreviation": "OST",
      "language": "fr",
      "format": "sqlite",
      "size_bytes": 5742592,
      "version": "1.0.0",
      "license": "Public Domain",
      "author": "Jean-Frédéric Ostervald (Éd. La Maison de la Bible)",
      "description": "Révision historique (1877) de la traduction protestante classique de Jean-Frédéric Ostervald. Fidèle à la lignée du Texte Reçu (Textus Receptus) pour le Nouveau Testament et du Texte Massorétique pour l'Ancien Testament, dans une langue française soignée et traditionnelle du XIXᵉ siècle.",
      "features": ["protestant_reformed", "textus_receptus", "historical_translation", "indexed_search"],
      "download_url": "https://raw.githubusercontent.com/Similarly1/open-shema-data/main/data/bibles/bible_ostervald.sqlite",
      "cover_url": "https://raw.githubusercontent.com/Similarly1/open-shema-data/main/data/covers/OST.png"
    },
    {
      "id": "bible-stapfer-1889",
      "type": "bible",
      "category": "bibles",
      "title": "Le Nouveau Testament (Traduction Edmond Stapfer)",
      "abbreviation": "STAPFER",
      "language": "fr",
      "format": "sqlite",
      "size_bytes": 1429504,
      "version": "1.0.0",
      "license": "Public Domain",
      "author": "Edmond Stapfer (Librairie Fischbacher)",
      "description": "Traduction historique du Nouveau Testament par le théologien protestant Edmond Stapfer (1889, Librairie Fischbacher). Traduit directement sur le texte grec comparé des meilleures éditions critiques de l'époque (Tischendorf, Westcott-Hort, Tregelles), offrant une langue soignée et une grande rigueur philologique.\n\nSource & formatage initial : Bible Parser (Didier Fontaine / Areopage.net). Intégration, restructuration et présentation UI : Open Shema.",
      "features": ["new_testament", "greek_critical_text", "protestant_reformed", "indexed_search"],
      "download_url": "https://raw.githubusercontent.com/Similarly1/open-shema-data/main/data/bibles/bible_stapfer.sqlite",
      "cover_url": "https://raw.githubusercontent.com/Similarly1/open-shema-data/main/data/covers/STAPFER.png"
    },
    {
      "id": "bible-septante-giguet-1872",
      "type": "bible",
      "category": "bibles",
      "title": "La Sainte Bible d'après les Septante",
      "abbreviation": "GIG",
      "language": "fr",
      "format": "sqlite",
      "size_bytes": 4149248,
      "version": "1.0.0",
      "license": "Public Domain",
      "author": "Pierre Giguet / Lethielleux",
      "description": "La première et magistrale traduction française intégrale de l'Ancien Testament d'après la version des Septante (texte grec d'Alexandrie) réalisée par Pierre Giguet en 4 tomes (1872).\n\nSource & formatage initial : Bible Parser (Didier Fontaine / Areopage.net). Intégration, restructuration et présentation UI : Open Shema.",
      "features": ["old_testament", "septuagint_lxx", "alexandrian_greek", "indexed_search"],
      "download_url": "https://raw.githubusercontent.com/Similarly1/open-shema-data/main/data/bibles/bible_septante_giguet.sqlite",
      "cover_url": "https://raw.githubusercontent.com/Similarly1/open-shema-data/main/data/covers/GIG.png"
    },
    {
      "id": "bible-ncl",
      "type": "bible",
      "category": "bibles",
      "title": "Sainte Bible néo-Crampon Libre",
      "abbreviation": "NCL",
      "language": "fr",
      "format": "sqlite",
      "size_bytes": 6590464,
      "version": "1.0.0",
      "license": "Creative Commons (CC-BY-SA 4.0)",
      "author": "Augustin Crampon (Révision Fraternité de Tibériade)",
      "description": "Révision linguistique et contemporaine de la traduction catholique intégrale (Ancien et Nouveau Testament) du Chanoine Augustin Crampon (1923) par la Fraternité de Tibériade. Traduction littérale et rigoureuse depuis l'hébreu et le grec, publiée sous licence ouverte Creative Commons (CC-BY-SA 4.0).",
      "features": ["deuterocanonical", "catholic_tradition", "contemporary_french", "indexed_search"],
      "download_url": "https://raw.githubusercontent.com/Similarly1/open-shema-data/main/data/bibles/bible_ncl.sqlite",
      "cover_url": "https://raw.githubusercontent.com/Similarly1/open-shema-data/main/data/covers/NCL.png"
    },
    {
      "id": "comm-calvin",
      "type": "commentary",
      "category": "commentaries",
      "title": "Commentaire Biblique de Jean Calvin",
      "abbreviation": "CBJC",
      "language": "fr",
      "format": "sqlite",
      "size_bytes": 38588416,
      "version": "1.0.0",
      "license": "Public Domain",
      "author": "Jean Calvin (Éd. Ch. Meyrueis / Dom. Public)",
      "description": "Ensemble des commentaires exégétiques et doctrinaux de Jean Calvin sur le Nouveau et l'Ancien Testament (12 175 passages indexés sur 48 livres). Texte intégral du domaine public restauré, modernisé et structuré en Markdown thématique avec mise en valeur des citations et références scripturaires.",
      "features": ["verse_by_verse", "structured_markdown", "scripture_crosslinks", "historical_reformed"],
      "download_url": "https://raw.githubusercontent.com/Similarly1/open-shema-data/main/data/commentaires/comm_calvin.sqlite",
      "cover_url": "https://raw.githubusercontent.com/Similarly1/open-shema-data/main/data/covers/CBJC.png"
    },
    {
      "id": "dataset-bibleproject-fr",
      "type": "dataset",
      "category": "datasets",
      "title": "BibleProject Français (Panoramas & Affiches)",
      "abbreviation": "BP-FR",
      "language": "fr",
      "format": "json",
      "size_bytes": 83000,
      "version": "1.0.0",
      "license": "Creative Commons / BibleProject",
      "author": "BibleProject",
      "description": "Indexation complète des vidéos de panorama des 66 livres bibliques en français et liens HD vers les affiches littéraires.",
      "features": ["video_links", "posters", "summaries"],
      "download_url": "https://raw.githubusercontent.com/Similarly1/open-shema-data/main/bibleproject_fr.json"
    }
  ]
}
